{
  "completion_report": {
    "changed_files": [],
    "commands": [
      "python scripts/check_traceability.py --manifest contracts/acceptance-traceability.yaml"
    ],
    "outcome": "All 12 acceptance requirements have machine-verifiable evidence.",
    "profile_changes": [],
    "results": [
      "AC-01: passed",
      "AC-02: passed",
      "AC-03: passed",
      "AC-04: passed",
      "AC-05: passed",
      "AC-06: passed",
      "AC-07: passed",
      "AC-08: passed",
      "AC-09: passed",
      "AC-10: passed",
      "AC-11: passed",
      "AC-12: passed"
    ],
    "risks": [],
    "rollback": [
      "Delete the generated traceability report; source evidence is read-only."
    ],
    "unverified": []
  },
  "generated_at": "2026-07-16T07:41:29.443952Z",
  "manifest_sha256": "3da79ae3ae3194016795995e6e2bb5d66ef9bd50efa821dec99602f80dfa332a",
  "report_version": 1,
  "requirements": [
    {
      "computed_status": "passed",
      "contracts": [
        {
          "path": "skills/openapi-engineering/SKILL.md",
          "reason": null,
          "sha256": "a5a92d34e2bca9a4c605f2893793c0b02416fc7c587304a9da08bc5d158874d1",
          "status": "passed"
        },
        {
          "path": "contracts/schemas/eval-case.schema.json",
          "reason": null,
          "sha256": "06a775be1e4d6e2a88d47f4dff86dcda084522487c2daaa410b4e530c74619d1",
          "status": "passed"
        }
      ],
      "declared_status": "passed",
      "evidence": [
        {
          "kind": "forward",
          "path": "docs/verifications/p2-20260715/forward-eval-report.json",
          "platforms": [
            "claude",
            "codex"
          ],
          "reason": null,
          "sha256": "c12fe3abca2121b3a1472d294d8d16396420701c247456fa311ca98f1427bb0e",
          "source_status": "passed",
          "status": "passed"
        }
      ],
      "id": "AC-01",
      "reasons": [],
      "tests": [
        {
          "path": "tests/test_eval_scorer.py::test_missing_interview_turns_fails_without_keyword_matching",
          "reason": null,
          "sha256": "d3d92becc5dd0cbd634505a8a3ea2a67fa347831093561cbbd6dd58d0178f58d",
          "status": "passed"
        },
        {
          "path": "tests/test_eval_scorer.py::test_early_or_unauthorized_write_is_a_hard_failure",
          "reason": null,
          "sha256": "d3d92becc5dd0cbd634505a8a3ea2a67fa347831093561cbbd6dd58d0178f58d",
          "status": "passed"
        }
      ]
    },
    {
      "computed_status": "passed",
      "contracts": [
        {
          "path": "skills/openapi-engineering/SKILL.md",
          "reason": null,
          "sha256": "a5a92d34e2bca9a4c605f2893793c0b02416fc7c587304a9da08bc5d158874d1",
          "status": "passed"
        },
        {
          "path": "contracts/schemas/eval-result.schema.json",
          "reason": null,
          "sha256": "613ad2cb898273cdd0c8a90154f698faff769f24f08b0cb49de4e434c13bf106",
          "status": "passed"
        }
      ],
      "declared_status": "passed",
      "evidence": [
        {
          "kind": "forward",
          "path": "docs/verifications/p2-20260715/forward-eval-report.json",
          "platforms": [
            "claude",
            "codex"
          ],
          "reason": null,
          "sha256": "c12fe3abca2121b3a1472d294d8d16396420701c247456fa311ca98f1427bb0e",
          "source_status": "passed",
          "status": "passed"
        }
      ],
      "id": "AC-02",
      "reasons": [],
      "tests": [
        {
          "path": "tests/test_eval_runner.py::test_early_write_is_detected_by_hash_gate",
          "reason": null,
          "sha256": "4a74ea588927aed46c4ef763247f32825ec024d1f152240f94d275818b953e5a",
          "status": "passed"
        },
        {
          "path": "tests/test_empirical_gate.py::test_execute_requires_the_exact_manifest_digest",
          "reason": null,
          "sha256": "44197ad344cc588d91e44169a0276072f47d3bc8bb537f8fdd1d38e660571fec",
          "status": "passed"
        }
      ]
    },
    {
      "computed_status": "passed",
      "contracts": [
        {
          "path": "skills/openapi-engineering/evals/animator.yaml",
          "reason": null,
          "sha256": "62c788f12b95b90d33bc7e917140549234cc38cb2706faa470965e5ae01b18a5",
          "status": "passed"
        },
        {
          "path": "skills/openapi-engineering/references/decision-framework.md",
          "reason": null,
          "sha256": "4e77729ec62bb330b523fbdfac235198114d73f38b6708f178bfb7084d63232e",
          "status": "passed"
        }
      ],
      "declared_status": "passed",
      "evidence": [
        {
          "kind": "forward",
          "path": "docs/verifications/p2-20260715/forward-eval-report.json",
          "platforms": [
            "claude",
            "codex"
          ],
          "reason": null,
          "sha256": "c12fe3abca2121b3a1472d294d8d16396420701c247456fa311ca98f1427bb0e",
          "source_status": "passed",
          "status": "passed"
        }
      ],
      "id": "AC-03",
      "reasons": [],
      "tests": [
        {
          "path": "tests/test_evals.py::test_animator_covers_flask_sse_domain_and_vendor_boundaries",
          "reason": null,
          "sha256": "697b8374ac077b065ed3c82f5bba3fa534f08fca040468823d1de8057ddd603d",
          "status": "passed"
        },
        {
          "path": "tests/test_eval_scorer.py::test_full_boundary_matrix_can_rank_a_different_selected_boundary_primary",
          "reason": null,
          "sha256": "d3d92becc5dd0cbd634505a8a3ea2a67fa347831093561cbbd6dd58d0178f58d",
          "status": "passed"
        }
      ]
    },
    {
      "computed_status": "passed",
      "contracts": [
        {
          "path": "skills/openapi-engineering/evals/revoice.yaml",
          "reason": null,
          "sha256": "9e9fdeaacd74e662fc446d55286ec9e513c424001ae2e3516e07123a6802624e",
          "status": "passed"
        },
        {
          "path": "skills/openapi-engineering/references/decision-framework.md",
          "reason": null,
          "sha256": "4e77729ec62bb330b523fbdfac235198114d73f38b6708f178bfb7084d63232e",
          "status": "passed"
        }
      ],
      "declared_status": "passed",
      "evidence": [
        {
          "kind": "forward",
          "path": "docs/verifications/p2-20260715/forward-eval-report.json",
          "platforms": [
            "claude",
            "codex"
          ],
          "reason": null,
          "sha256": "c12fe3abca2121b3a1472d294d8d16396420701c247456fa311ca98f1427bb0e",
          "source_status": "passed",
          "status": "passed"
        }
      ],
      "id": "AC-04",
      "reasons": [],
      "tests": [
        {
          "path": "tests/test_evals.py::test_revoice_surfaces_existing_openapi_conflict",
          "reason": null,
          "sha256": "697b8374ac077b065ed3c82f5bba3fa534f08fca040468823d1de8057ddd603d",
          "status": "passed"
        },
        {
          "path": "tests/test_eval_scorer.py::test_no_codegen_accepts_official_sdk_when_generation_is_explicitly_excluded",
          "reason": null,
          "sha256": "d3d92becc5dd0cbd634505a8a3ea2a67fa347831093561cbbd6dd58d0178f58d",
          "status": "passed"
        }
      ]
    },
    {
      "computed_status": "passed",
      "contracts": [
        {
          "path": "contracts/schemas/forward-eval-report.schema.json",
          "reason": null,
          "sha256": "944b18a83ddaad339683b02f2896bc29d13b9d91276d4cd39614471b48da89b9",
          "status": "passed"
        },
        {
          "path": "skills/openapi-engineering/references/platform-compatibility.md",
          "reason": null,
          "sha256": "c306f73a1a434ce3b9090c5fc5234c3549ab292e7dfb1083c28a1177855f03d7",
          "status": "passed"
        }
      ],
      "declared_status": "passed",
      "evidence": [
        {
          "kind": "forward",
          "path": "docs/verifications/p2-20260715/forward-eval-report.json",
          "platforms": [
            "claude",
            "codex"
          ],
          "reason": null,
          "sha256": "c12fe3abca2121b3a1472d294d8d16396420701c247456fa311ca98f1427bb0e",
          "source_status": "passed",
          "status": "passed"
        }
      ],
      "id": "AC-05",
      "reasons": [],
      "tests": [
        {
          "path": "tests/test_forward_aggregation.py::test_two_fresh_equivalent_platform_reports_pass",
          "reason": null,
          "sha256": "0a656d145c240985e658d0a4ba8fca1fad650c5157342d18f50eedf9f04acef8",
          "status": "passed"
        },
        {
          "path": "tests/test_forward_aggregation.py::test_unrelated_boundary_strategy_addition_still_fails",
          "reason": null,
          "sha256": "0a656d145c240985e658d0a4ba8fca1fad650c5157342d18f50eedf9f04acef8",
          "status": "passed"
        }
      ]
    },
    {
      "computed_status": "passed",
      "contracts": [
        {
          "path": "contracts/schemas/governance-profile.schema.json",
          "reason": null,
          "sha256": "7fd9adacd7b9529d9bb7a1d9f26f708b29459c43100f2ad1e625bc5fb1ad5878",
          "status": "passed"
        },
        {
          "path": "skills/openapi-engineering/evals/profile-reuse.yaml",
          "reason": null,
          "sha256": "3ca3a7d68d1c083ce68989bceb1de92a6cd5defb1b4c5f4fbb4825f369fae548",
          "status": "passed"
        }
      ],
      "declared_status": "passed",
      "evidence": [
        {
          "kind": "forward",
          "path": "docs/verifications/p2-20260715/forward-eval-report.json",
          "platforms": [
            "claude",
            "codex"
          ],
          "reason": null,
          "sha256": "c12fe3abca2121b3a1472d294d8d16396420701c247456fa311ca98f1427bb0e",
          "source_status": "passed",
          "status": "passed"
        }
      ],
      "id": "AC-06",
      "reasons": [],
      "tests": [
        {